<?xml version="1.0" encoding="UTF-8"?>
<xsd:schema xmlns:xsd="http://www.w3.org/2001/XMLSchema" xmlns:od="urn:schemas-microsoft-com:officedata">
<xsd:element name="dataroot">
<xsd:complexType>
<xsd:sequence>
<xsd:element ref="building_levels" minOccurs="0" maxOccurs="unbounded"/>
</xsd:sequence>
<xsd:attribute name="generated" type="xsd:dateTime"/>
</xsd:complexType>
</xsd:element>
<xsd:element name="building_levels">
<xsd:annotation>
<xsd:appinfo>
<od:index index-name="PrimaryKey" index-key="level_name " primary="yes" unique="yes" clustered="no"/>
<od:index index-name="s_GUID" index-key="s_GUID " primary="no" unique="yes" clustered="no"/>
<od:index index-name="building_chainsbuilding_levels" index-key="chain " primary="no" unique="no" clustered="no"/>
<od:index index-name="commoditiesbuilding_levels" index-key="commodity " primary="no" unique="no" clustered="no"/>
<od:index index-name="gov_type_key" index-key="gov_type_key " primary="no" unique="no" clustered="no"/>
<od:index index-name="s_Generation" index-key="s_Generation " primary="no" unique="no" clustered="no"/>
</xsd:appinfo>
</xsd:annotation>
<xsd:complexType>
<xsd:sequence>
<xsd:element name="level_name" minOccurs="0" od:jetType="text" od:sqlSType="nvarchar">
<xsd:simpleType>
<xsd:restriction base="xsd:string">
<xsd:maxLength value="50"/>
</xsd:restriction>
</xsd:simpleType>
</xsd:element>
<xsd:element name="chain" minOccurs="0" od:jetType="text" od:sqlSType="nvarchar">
<xsd:simpleType>
<xsd:restriction base="xsd:string">
<xsd:maxLength value="50"/>
</xsd:restriction>
</xsd:simpleType>
</xsd:element>
<xsd:element name="level" minOccurs="0" od:jetType="longinteger" od:sqlSType="int" type="xsd:int"/>
<xsd:element name="condition" minOccurs="0" od:jetType="memo" od:sqlSType="ntext">
<xsd:simpleType>
<xsd:restriction base="xsd:string">
<xsd:maxLength value="536870910"/>
</xsd:restriction>
</xsd:simpleType>
</xsd:element>
<xsd:element name="only_in_capital" minOccurs="1" od:jetType="yesno" od:sqlSType="bit" od:nonNullable="yes" type="xsd:boolean"/>
<xsd:element name="create_time" minOccurs="0" od:jetType="integer" od:sqlSType="smallint" type="xsd:short"/>
<xsd:element name="create_cost" minOccurs="0" od:jetType="longinteger" od:sqlSType="int" type="xsd:int"/>
<xsd:element name="upkeep_cost" minOccurs="0" od:jetType="integer" od:sqlSType="smallint" type="xsd:short"/>
<xsd:element name="demolition_cost" minOccurs="0" od:jetType="integer" od:sqlSType="smallint" type="xsd:short"/>
<xsd:element name="zoc" minOccurs="0" od:jetType="double" od:sqlSType="float" type="xsd:double"/>
<xsd:element name="lower_happiness" minOccurs="0" od:jetType="longinteger" od:sqlSType="int" type="xsd:int"/>
<xsd:element name="upper_happiness" minOccurs="0" od:jetType="longinteger" od:sqlSType="int" type="xsd:int"/>
<xsd:element name="repression" minOccurs="0" od:jetType="longinteger" od:sqlSType="int" type="xsd:int"/>
<xsd:element name="gdp" minOccurs="0" od:jetType="longinteger" od:sqlSType="int" type="xsd:int"/>
<xsd:element name="town_wealth_growth" minOccurs="0" od:jetType="longinteger" od:sqlSType="int" type="xsd:int"/>
<xsd:element name="pop_change" minOccurs="0" od:jetType="double" od:sqlSType="float" type="xsd:double"/>
<xsd:element name="maxpop_change" minOccurs="0" od:jetType="double" od:sqlSType="float" type="xsd:double"/>
<xsd:element name="commodity" minOccurs="0" od:jetType="text" od:sqlSType="nvarchar">
<xsd:simpleType>
<xsd:restriction base="xsd:string">
<xsd:maxLength value="50"/>
</xsd:restriction>
</xsd:simpleType>
</xsd:element>
<xsd:element name="commodity_vol" minOccurs="0" od:jetType="longinteger" od:sqlSType="int" type="xsd:int"/>
<xsd:element name="building_category" minOccurs="0" od:jetType="text" od:sqlSType="nvarchar">
<xsd:simpleType>
<xsd:restriction base="xsd:string">
<xsd:maxLength value="255"/>
</xsd:restriction>
</xsd:simpleType>
</xsd:element>
<xsd:element name="gov_type_key" minOccurs="0" od:jetType="text" od:sqlSType="nvarchar">
<xsd:simpleType>
<xsd:restriction base="xsd:string">
<xsd:maxLength value="50"/>
</xsd:restriction>
</xsd:simpleType>
</xsd:element>
<xsd:element name="military_prestige" minOccurs="0" od:jetType="longinteger" od:sqlSType="int" type="xsd:int"/>
<xsd:element name="naval_prestige" minOccurs="0" od:jetType="longinteger" od:sqlSType="int" type="xsd:int"/>
<xsd:element name="economic_prestige" minOccurs="0" od:jetType="longinteger" od:sqlSType="int" type="xsd:int"/>
<xsd:element name="enlightenment_prestige" minOccurs="0" od:jetType="longinteger" od:sqlSType="int" type="xsd:int"/>
<xsd:element name="Gen_condition" minOccurs="0" od:jetType="longinteger" od:sqlSType="int" type="xsd:int"/>
<xsd:element name="s_ColLineage" minOccurs="0" od:jetType="oleobject" od:sqlSType="image">
<xsd:simpleType>
<xsd:restriction base="xsd:base64Binary">
<xsd:maxLength value="1476395008"/>
</xsd:restriction>
</xsd:simpleType>
</xsd:element>
<xsd:element name="s_Generation" minOccurs="0" od:jetType="longinteger" od:sqlSType="int" type="xsd:int"/>
<xsd:element name="s_GUID" minOccurs="0" od:jetType="replicationid" od:sqlSType="uniqueidentifier" od:autoUnique="yes">
<xsd:simpleType>
<xsd:restriction base="xsd:string">
<xsd:maxLength value="38"/>
</xsd:restriction>
</xsd:simpleType>
</xsd:element>
<xsd:element name="s_Lineage" minOccurs="0" od:jetType="oleobject" od:sqlSType="image">
<xsd:simpleType>
<xsd:restriction base="xsd:base64Binary">
<xsd:maxLength value="1476395008"/>
</xsd:restriction>
</xsd:simpleType>
</xsd:element>
</xsd:sequence>
</xsd:complexType>
</xsd:element>
</xsd:schema>
